{
  "schema_version": "0.5.0",
  "pack": {
    "id": "frostwatch-vale",
    "title": "Frostwatch Vale",
    "version": "0.1.0-alpha.7",
    "generator": {
      "name": "Mapsoo Worldsmith",
      "version": "0.1.0-alpha.7"
    },
    "created_at": "2026-07-19T12:00:00.000Z"
  },
  "compatibility": {
    "godot_min": "4.3",
    "grid": "orthogonal",
    "art_style": "pixel_art",
    "importer": {
      "id": "mapsoo_importer",
      "min_version": "0.1.0-alpha.7",
      "source": "https://github.com/babyrush0101-source/mapsoo-kids"
    }
  },
  "world_spec": {
    "path": "worlds/frostwatch-vale.world.json",
    "sha256": "41547ed2c93bb72266c40a37ec0d6a85a391b97423ad78339b1144d1274216cb"
  },
  "demo": {
    "map": "worlds/demo-world.json",
    "preview": "previews/map-preview.png"
  },
  "layers": [
    {
      "id": "ground",
      "kind": "tilemap",
      "path": "worlds/demo-world.json",
      "json_pointer": "/layers/0/cells",
      "encoding": "row-major",
      "dimensions_cells": [
        24,
        16
      ],
      "atlas_id": "terrain",
      "empty_tile_id": -1
    },
    {
      "id": "water",
      "kind": "tilemap",
      "path": "worlds/demo-world.json",
      "json_pointer": "/layers/1/cells",
      "encoding": "row-major",
      "dimensions_cells": [
        24,
        16
      ],
      "atlas_id": "terrain",
      "empty_tile_id": -1
    },
    {
      "id": "roads",
      "kind": "tilemap",
      "path": "worlds/demo-world.json",
      "json_pointer": "/layers/2/cells",
      "encoding": "row-major",
      "dimensions_cells": [
        24,
        16
      ],
      "atlas_id": "terrain",
      "empty_tile_id": -1
    },
    {
      "id": "props",
      "kind": "objects",
      "path": "worlds/demo-world.json",
      "json_pointer": "/props",
      "encoding": "objects",
      "sprite_atlas": "atlases/props.png"
    }
  ],
  "terrain_sets": [
    {
      "id": "water",
      "mode": "match-sides",
      "terrains": [
        {
          "id": "water",
          "name": "Water",
          "color": "#4e82a6"
        }
      ]
    },
    {
      "id": "roads",
      "mode": "match-sides",
      "terrains": [
        {
          "id": "road",
          "name": "Road",
          "color": "#a8bbc8"
        }
      ]
    }
  ],
  "physics_layers": [
    {
      "id": "world-blocking",
      "collision_layer": 1,
      "collision_mask": 1
    }
  ],
  "receipt": {
    "path": "generation-receipt.json"
  },
  "atlases": [
    {
      "id": "terrain",
      "source_id": 0,
      "file": "atlases/terrain.png",
      "image_size_px": [
        256,
        192
      ],
      "cell_size_px": [
        32,
        32
      ],
      "margin_px": [
        0,
        0
      ],
      "separation_px": [
        0,
        0
      ],
      "texture_padding": true,
      "tiles": [
        {
          "tile_id": 0,
          "id": "ground-base-a",
          "atlas_coords": [
            0,
            0
          ],
          "size_cells": [
            1,
            1
          ],
          "alternative_id": 0,
          "collision": {
            "type": "none"
          },
          "terrain": null,
          "custom_data": {
            "walkable": true,
            "biome": "snow"
          },
          "tags": [
            "terrain",
            "ground",
            "ground-base-a"
          ]
        },
        {
          "tile_id": 1,
          "id": "ground-base-b",
          "atlas_coords": [
            1,
            0
          ],
          "size_cells": [
            1,
            1
          ],
          "alternative_id": 0,
          "collision": {
            "type": "none"
          },
          "terrain": null,
          "custom_data": {
            "walkable": true,
            "biome": "snow"
          },
          "tags": [
            "terrain",
            "ground",
            "ground-base-b"
          ]
        },
        {
          "tile_id": 2,
          "id": "ground-detail",
          "atlas_coords": [
            2,
            0
          ],
          "size_cells": [
            1,
            1
          ],
          "alternative_id": 0,
          "collision": {
            "type": "none"
          },
          "terrain": null,
          "custom_data": {
            "walkable": true,
            "biome": "snow"
          },
          "tags": [
            "terrain",
            "ground",
            "ground-detail"
          ]
        },
        {
          "tile_id": 16,
          "id": "water-0",
          "atlas_coords": [
            0,
            2
          ],
          "size_cells": [
            1,
            1
          ],
          "alternative_id": 0,
          "collision": {
            "type": "full-cell",
            "physics_layer": "world-blocking"
          },
          "terrain": {
            "set_id": "water",
            "terrain_id": "water",
            "peering": {
              "north": null,
              "east": null,
              "south": null,
              "west": null
            }
          },
          "custom_data": {
            "walkable": false,
            "biome": "snow"
          },
          "tags": [
            "terrain",
            "water",
            "mask-0"
          ]
        },
        {
          "tile_id": 17,
          "id": "water-1",
          "atlas_coords": [
            1,
            2
          ],
          "size_cells": [
            1,
            1
          ],
          "alternative_id": 0,
          "collision": {
            "type": "full-cell",
            "physics_layer": "world-blocking"
          },
          "terrain": {
            "set_id": "water",
            "terrain_id": "water",
            "peering": {
              "north": "water",
              "east": null,
              "south": null,
              "west": null
            }
          },
          "custom_data": {
            "walkable": false,
            "biome": "snow"
          },
          "tags": [
            "terrain",
            "water",
            "mask-1"
          ]
        },
        {
          "tile_id": 18,
          "id": "water-2",
          "atlas_coords": [
            2,
            2
          ],
          "size_cells": [
            1,
            1
          ],
          "alternative_id": 0,
          "collision": {
            "type": "full-cell",
            "physics_layer": "world-blocking"
          },
          "terrain": {
            "set_id": "water",
            "terrain_id": "water",
            "peering": {
              "north": null,
              "east": "water",
              "south": null,
              "west": null
            }
          },
          "custom_data": {
            "walkable": false,
            "biome": "snow"
          },
          "tags": [
            "terrain",
            "water",
            "mask-2"
          ]
        },
        {
          "tile_id": 19,
          "id": "water-3",
          "atlas_coords": [
            3,
            2
          ],
          "size_cells": [
            1,
            1
          ],
          "alternative_id": 0,
          "collision": {
            "type": "full-cell",
            "physics_layer": "world-blocking"
          },
          "terrain": {
            "set_id": "water",
            "terrain_id": "water",
            "peering": {
              "north": "water",
              "east": "water",
              "south": null,
              "west": null
            }
          },
          "custom_data": {
            "walkable": false,
            "biome": "snow"
          },
          "tags": [
            "terrain",
            "water",
            "mask-3"
          ]
        },
        {
          "tile_id": 20,
          "id": "water-4",
          "atlas_coords": [
            4,
            2
          ],
          "size_cells": [
            1,
            1
          ],
          "alternative_id": 0,
          "collision": {
            "type": "full-cell",
            "physics_layer": "world-blocking"
          },
          "terrain": {
            "set_id": "water",
            "terrain_id": "water",
            "peering": {
              "north": null,
              "east": null,
              "south": "water",
              "west": null
            }
          },
          "custom_data": {
            "walkable": false,
            "biome": "snow"
          },
          "tags": [
            "terrain",
            "water",
            "mask-4"
          ]
        },
        {
          "tile_id": 21,
          "id": "water-5",
          "atlas_coords": [
            5,
            2
          ],
          "size_cells": [
            1,
            1
          ],
          "alternative_id": 0,
          "collision": {
            "type": "full-cell",
            "physics_layer": "world-blocking"
          },
          "terrain": {
            "set_id": "water",
            "terrain_id": "water",
            "peering": {
              "north": "water",
              "east": null,
              "south": "water",
              "west": null
            }
          },
          "custom_data": {
            "walkable": false,
            "biome": "snow"
          },
          "tags": [
            "terrain",
            "water",
            "mask-5"
          ]
        },
        {
          "tile_id": 22,
          "id": "water-6",
          "atlas_coords": [
            6,
            2
          ],
          "size_cells": [
            1,
            1
          ],
          "alternative_id": 0,
          "collision": {
            "type": "full-cell",
            "physics_layer": "world-blocking"
          },
          "terrain": {
            "set_id": "water",
            "terrain_id": "water",
            "peering": {
              "north": null,
              "east": "water",
              "south": "water",
              "west": null
            }
          },
          "custom_data": {